{
  "schema_version": "evaluation_run.v1",
  "run": {
    "run_id": "dad43046-2012-42f3-9d44-a015abc727c3",
    "created_at": "2026-05-13T14:27:28Z",
    "run_kind_requested": "full",
    "run_kind_effective": "full",
    "baseline_run_id": null,
    "pipeline_capability_epoch": 1,
    "artifact_path": "D:\\tools\\cursorLogViewer\\org_contributor_pipeline\\artifacts\\generated\\gitlab_group_artifact_scoped.json",
    "artifact_fingerprint": "f0ee2a724f5a8620febd5a11",
    "window_start": "2026-03-01T00:00:00Z",
    "window_end": "2026-05-13T00:00:00Z",
    "gitlab_group": "h5_game_sh_tpe",
    "ingest": {
      "source": "gitlab_api_v4",
      "commit_row_count": 2595
    },
    "plugins_applied": [
      "delivery_traceability@0.1.0",
      "commit_title_signals@0.1.0",
      "path_taxonomy_proxy@0.1.0",
      "identity_footprint@0.1.0"
    ]
  },
  "workflow": {
    "version": 1,
    "description_zh": "新增考核能力或更换 rubric/插件世代 → 对项目做一次全量审核并打底分；之后在同一基线上可对增量提交续打分。若当前资料不足以稳定打分（证据门槛未全绿），下一次须先全量，不要只做增量。",
    "triggers_full_rescore_zh": [
      "pipeline_capability_epoch 递增（新插件/新 ingest 口径）",
      "evaluation_scope / mailmap 变更",
      "artifact 时间窗大幅变更",
      "workflow.derived_next_run_recommendation 为 full（证据不足或 partial）"
    ],
    "incremental_merge": {
      "uses_baseline_json": false,
      "applied": false,
      "copies_non_null_grades": true,
      "facts_always_from_current_artifact": true,
      "includes_prior_attachment": false
    },
    "evidence_tier": "weak",
    "derived_next_run_recommendation": "full",
    "reason_codes": [
      "evidence_partial_not_enough_for_stable_scores"
    ],
    "reason_zh": "存在必评人员资料不足以稳定覆盖必审 L2（diff/体量门槛未过）；下次仍须先全量打分。",
    "coercion": null
  },
  "rubric": {
    "review_framework_schema_version": 1,
    "review_framework_title_zh": "必审能力块与证据口径（非仅靠插件）",
    "mandatory_l2_count": 14,
    "mandatory_l2_dimensions": [
      {
        "l1_id": "technical_fundamentals",
        "l1_title_zh": "基础技术能力",
        "l2_id": "cs_complexity",
        "l2_title_zh": "数据结构、算法与复杂度",
        "evidence_zh": "优先 MR/CR/面试；无则：从标题与变更体量推断是否触及算法/边界类工作，不可见处标「—」并说明缺 diff。"
      },
      {
        "l1_id": "technical_fundamentals",
        "l1_title_zh": "基础技术能力",
        "l2_id": "language_runtime",
        "l2_title_zh": "语言深度与运行栈",
        "evidence_zh": "从仓库技术栈（路径、扩展名、标题关键词如 TS/并发/内存）与持续提交模式写可见线索；深度结论须待 MR 或静态分析。"
      },
      {
        "l1_id": "technical_fundamentals",
        "l1_title_zh": "基础技术能力",
        "l2_id": "data_storage",
        "l2_title_zh": "数据与持久化",
        "evidence_zh": "标题/路径是否出现迁移、事务、索引、ORM 等；无则 N/A（材料）+ 一句补证建议。"
      },
      {
        "l1_id": "technical_fundamentals",
        "l1_title_zh": "基础技术能力",
        "l2_id": "design_tooling",
        "l2_title_zh": "设计表达与工程化底座",
        "evidence_zh": "构建/依赖/重构/模块化类标题与路径；可与 design_tooling、工程化目录变更交叉。"
      },
      {
        "l1_id": "engineering_ability",
        "l1_title_zh": "工程能力",
        "l2_id": "structure_modularity",
        "l2_title_zh": "结构、模块化与解耦",
        "evidence_zh": "从路径分层、拆分/合并提交、子模块与 common 触碰写事实句；不等价架构评审。"
      },
      {
        "l1_id": "engineering_ability",
        "l1_title_zh": "工程能力",
        "l2_id": "maintainability",
        "l2_title_zh": "可维护性与演进",
        "evidence_zh": "重构、清理、命名、Revert 链、文档类提交；须与具体 sha 标题挂钩。"
      },
      {
        "l1_id": "engineering_ability",
        "l1_title_zh": "工程能力",
        "l2_id": "quality_gates",
        "l2_title_zh": "规范与质量门禁",
        "evidence_zh": "插件 commit_title_signals 弱代理 + 标题中 test/lint 等；缺 CI 结果则标材料缺口。"
      },
      {
        "l1_id": "engineering_ability",
        "l1_title_zh": "工程能力",
        "l2_id": "cicd_release",
        "l2_title_zh": "CI/CD 与发布",
        "evidence_zh": "标题/路径中 CI、release、workflow 类 + commit_title_signals；可要求补 pipeline 链接。"
      },
      {
        "l1_id": "engineering_ability",
        "l1_title_zh": "工程能力",
        "l2_id": "observability_debug",
        "l2_title_zh": "可观测性与排障",
        "evidence_zh": "日志/指标/trace 类标题 + commit_title_signals；无线上工单则置信度标低。"
      },
      {
        "l1_id": "engineering_ability",
        "l1_title_zh": "工程能力",
        "l2_id": "vcs_footprint",
        "l2_title_zh": "版本库活动与可追溯（Git 代理）",
        "evidence_zh": "插件 delivery_traceability；与 title/web_url 完整度交叉。"
      },
      {
        "l1_id": "system_design",
        "l1_title_zh": "系统设计能力",
        "l2_id": "architecture_boundaries",
        "l2_title_zh": "架构与边界",
        "evidence_zh": "path_taxonomy_proxy 为路径粗分 + commit 跨仓模式；须 disclaimer，重大结论待 MR/设计文档。"
      },
      {
        "l1_id": "system_design",
        "l1_title_zh": "系统设计能力",
        "l2_id": "scale_reliability",
        "l2_title_zh": "规模、并发与可用性",
        "evidence_zh": "标题/路径中限流、容灾、多活、并发等关键词；无则 — 或 N/A（材料）。"
      },
      {
        "l1_id": "system_design",
        "l1_title_zh": "系统设计能力",
        "l2_id": "data_platform_patterns",
        "l2_title_zh": "数据路径与中间件",
        "evidence_zh": "MQ/缓存/消费顺序等标题或配置路径线索；无则说明缺中间件变更样本。"
      },
      {
        "l1_id": "system_design",
        "l1_title_zh": "系统设计能力",
        "l2_id": "state_consistency_cost",
        "l2_title_zh": "状态、一致性与成本",
        "evidence_zh": "状态机、补偿、费用、扩缩容相关标题；弱线索时标低置信。"
      }
    ]
  },
  "people": [
    {
      "display_zh": "林耕宇",
      "person_key": "ericlin09.fgrd3@gmail.com",
      "game_zh": "赛特2",
      "primary_project_path_prefix": "h5_game_sh_tpe/seth2",
      "evidence_gate": "sufficient",
      "facts": {
        "window_activity": {
          "commit_rows": 882,
          "insertions": 325373,
          "deletions": 215256,
          "distinct_projects": 13,
          "first_day": "2026-03-02",
          "last_day": "2026-05-12"
        },
        "commit_diff": {
          "commit_diff_ok": 0,
          "commit_diff_truncated_commits": 0,
          "diff_path_suffix_top": []
        },
        "title_signal_commit_hits": {
          "cicd": 0,
          "observability": 22,
          "quality_gate": 7,
          "fix_like": 0,
          "game_biz": 0,
          "merge_like": 39
        },
        "path_taxonomy_buckets": {
          "game_client_repo": 647,
          "common_or_shared_stack": 191,
          "art_or_asset_pipeline": 40,
          "extension_tools": 4
        },
        "delivery_vcs_summed": {
          "delivery_slices": 13,
          "vcs_commit_count_summed": 882,
          "vcs_active_days_summed": 133,
          "vcs_max_lines_single_commit": 81560
        },
        "largest_commits_sample": [
          {
            "sha": "6589f571582735d5eb4e375007eef4576ffbca1e",
            "project_path": "h5_game_sh_tpe/common/project-h-artcommon",
            "title": "init proj",
            "lines_changed": 81560,
            "web_url": "https://gitlab.fingergame.com/h5_game_sh_tpe/common/project-h-artcommon/-/commit/6589f571582735d5eb4e375007eef4576ffbca1e"
          },
          {
            "sha": "49891da3a1dd0c1359a2de3fdf25b5b9007a8e40",
            "project_path": "h5_game_sh_tpe/seth2/proj-h-client",
            "title": "init proj",
            "lines_changed": 71306,
            "web_url": "https://gitlab.fingergame.com/h5_game_sh_tpe/seth2/proj-h-client/-/commit/49891da3a1dd0c1359a2de3fdf25b5b9007a8e40"
          },
          {
            "sha": "ba0c380b3effeb95a6218efee8f923f91e951c50",
            "project_path": "h5_game_sh_tpe/seth2/proj-l-client",
            "title": "更新: l10n 語言改為預設繁體中文",
            "lines_changed": 66937,
            "web_url": "https://gitlab.fingergame.com/h5_game_sh_tpe/seth2/proj-l-client/-/commit/ba0c380b3effeb95a6218efee8f923f91e951c50"
          },
          {
            "sha": "545eef6eb8ce2abb5894cf641a8a358ee1f67b41",
            "project_path": "h5_game_sh_tpe/seth2/proj-l-client-artwork",
            "title": "Merge branch 'master' of https://gitlab.fingergame.com/h5_game_sh_tpe/seth2/proj-l-client-artwork",
            "lines_changed": 32122,
            "web_url": "https://gitlab.fingergame.com/h5_game_sh_tpe/seth2/proj-l-client-artwork/-/commit/545eef6eb8ce2abb5894cf641a8a358ee1f67b41"
          },
          {
            "sha": "0a3cf1cd773f7668ad806852ac1a6bdcef6a681d",
            "project_path": "h5_game_sh_tpe/extension-tools/common-ui/project-l",
            "title": "移除: dev 相關代碼與資源",
            "lines_changed": 25845,
            "web_url": "https://gitlab.fingergame.com/h5_game_sh_tpe/extension-tools/common-ui/project-l/-/commit/0a3cf1cd773f7668ad806852ac1a6bdcef6a681d"
          }
        ]
      },
      "mandatory_l2_scores": [
        {
          "l1_id": "technical_fundamentals",
          "l1_title_zh": "基础技术能力",
          "l2_id": "cs_complexity",
          "l2_title_zh": "数据结构、算法与复杂度",
          "evidence_zh": "优先 MR/CR/面试；无则：从标题与变更体量推断是否触及算法/边界类工作，不可见处标「—」并说明缺 diff。",
          "grade": null,
          "confidence": null,
          "narrative_zh": null,
          "filled_by": null,
          "filled_at": null,
          "inherited_from_run_id": null
        },
        {
          "l1_id": "technical_fundamentals",
          "l1_title_zh": "基础技术能力",
          "l2_id": "language_runtime",
          "l2_title_zh": "语言深度与运行栈",
          "evidence_zh": "从仓库技术栈（路径、扩展名、标题关键词如 TS/并发/内存）与持续提交模式写可见线索；深度结论须待 MR 或静态分析。",
          "grade": null,
          "confidence": null,
          "narrative_zh": null,
          "filled_by": null,
          "filled_at": null,
          "inherited_from_run_id": null
        },
        {
          "l1_id": "technical_fundamentals",
          "l1_title_zh": "基础技术能力",
          "l2_id": "data_storage",
          "l2_title_zh": "数据与持久化",
          "evidence_zh": "标题/路径是否出现迁移、事务、索引、ORM 等；无则 N/A（材料）+ 一句补证建议。",
          "grade": null,
          "confidence": null,
          "narrative_zh": null,
          "filled_by": null,
          "filled_at": null,
          "inherited_from_run_id": null
        },
        {
          "l1_id": "technical_fundamentals",
          "l1_title_zh": "基础技术能力",
          "l2_id": "design_tooling",
          "l2_title_zh": "设计表达与工程化底座",